{
  "schema": "evopilot-real-host-acceptance-manifest/v3",
  "id": "evopilot-harness-v4.7.0-target-revision-1-real-host",
  "target": {
    "id": "evopilot-harness-v4.7.0-governed-project-ontology-and-multi-pack-lifecycle",
    "revision": 1,
    "status": "APPROVED",
    "repoPath": "governance/targets/evopilot-harness-v4.7.0-governed-project-ontology-and-multi-pack-lifecycle.json",
    "fileDigest": "sha256:70162fe4332a2dc1d8e08fe257797bbc94c5c0bf9097e14573d195d356f8217b",
    "authorizationDigest": "sha256:5e3641cc5883730f5992cc7b270d14388c25c09cd679462a51b79247536bb5ab",
    "roadmapDigest": "sha256:038b193ed25cfcf016d26aea011ea29362fa3461dc4612dc36c51cc2a83d8c0b"
  },
  "requiredExtensions": {
    "hostAdapterId": "workbuddy-macos-designated-human-v1",
    "compatibilityAdapterId": "agent-operations-v3-source-first"
  },
  "coverage": {
    "mode": "ALL_TARGET_ACCEPTANCE_IDS",
    "acceptanceCount": 22,
    "sortedAcceptanceIdsDigest": "sha256:f625a89ee6837f14ba529166a6d892108c6836a8b7675cd4a596349dc5c494dd",
    "realCasePortfolioPolicy": "compact-real-case-portfolio/v1",
    "realCaseCount": 5,
    "realCaseIds": ["RC01", "RC02", "RC03", "RC04", "RC05"],
    "machineVariantCount": 10,
    "machineVariantIds": ["MV01", "MV02", "MV03", "MV04", "MV05", "MV06", "MV07", "MV08", "MV09", "MV10"]
  },
  "hostExecutionPolicy": {
    "policyVersion": "human-operated-workbuddy/v1",
    "completionPolicyVersion": "designated-human-range-completion/v1",
    "portfolioPolicyVersion": "compact-real-case-portfolio/v1",
    "workBuddyOperator": "DESIGNATED_HUMAN",
    "codexRole": "RUNBOOK_ISSUANCE_AND_FINAL_DECLARATION_ONLY",
    "workBuddyUiControlAllowed": false,
    "workBuddyObservationAllowed": false,
    "workBuddyExecutionArtifactsRequired": false,
    "perCaseReportRequired": false,
    "automatedWorkBuddyQualificationRequired": false,
    "automatedWorkBuddyTransportReceiptRequired": false,
    "independentHostAutomationAllowed": true,
    "finalDeclaration": "RC01～RC05 已完成",
    "acceptedRangeSeparators": ["～", "~"],
    "beforeDeclaration": "PENDING",
    "afterDeclaration": "PASSED",
    "workBuddyCaseIds": ["RC01", "RC02", "RC03", "RC04", "RC05"],
    "discoveryOnlyCaseIds": [],
    "nonWorkBuddyMachineVariantIds": ["MV01", "MV02", "MV03", "MV04", "MV05", "MV06", "MV07", "MV08", "MV09", "MV10"]
  },
  "executionOrder": [
    "VERIFY_APPROVED_TARGET_REVISION_1_AND_EXTERNAL_CANDIDATE_BINDING",
    "VERIFY_ALL_22_CURRENT_AND_225_INHERITED_ACCEPTANCE_CRITERIA",
    "FREEZE_EXACTLY_FIVE_CANDIDATE_BOUND_WORKBUDDY_RUNBOOKS",
    "EXECUTE_AUTHORIZED_10_NON_WORKBUDDY_MACHINE_VARIANTS_UNTIL_FAILURE_OR_HUMAN_GATE",
    "KEEP_ALL_FIVE_WORKBUDDY_LEGS_PENDING_UNTIL_FINAL_DECLARATION",
    "VERIFY_NO_REGRESSION_AND_TARGET_GATES"
  ],
  "prohibitedEffects": [
    "No Candidate identity in this Target manifest",
    "No Codex WorkBuddy operation or observation",
    "No WorkBuddy execution-artifact request",
    "No Source execution or mutation",
    "No executable Pack content or private Organization material leakage",
    "No LLM-, Host-, or imported-evidence-owned identifier, merge, trust, approval, publication, installation, activation, or lifecycle decision",
    "No v4.8 incremental reasoning, federated discovery, external reasoner, semantic index, or large-Catalog capability",
    "No automatic repair, Catalog activation, publication or Release"
  ],
  "authority": {
    "authorizesHostMutation": false,
    "authorizesHumanDecision": false,
    "authorizesPublication": false,
    "authorizesRelease": false
  }
}
