{
  "schema": "evopilot-real-host-acceptance-manifest/v3",
  "id": "evopilot-harness-v4.8.0-target-revision-1-real-host",
  "target": {
    "id": "evopilot-harness-v4.8.0-scalable-semantic-interoperability",
    "revision": 1,
    "status": "APPROVED",
    "repoPath": "governance/targets/evopilot-harness-v4.8.0-scalable-semantic-interoperability.json",
    "fileDigest": "sha256:d96dbad410da66c36b016f19fe0cfe4aa63d58dcf20ace0d8ddb26bdb9a127cb",
    "authorizationDigest": "sha256:da932aaacf2aa6e2ba4b24bb558b041c99ae4d2128ce7f529b3435aafcd37445",
    "roadmapDigest": "sha256:d02eb6b03780e0f6d45214df5120955adc6127af0e91f72f1d81f2e1e76eedcc"
  },
  "requiredExtensions": {
    "hostAdapterId": "workbuddy-macos-designated-human-v1",
    "compatibilityAdapterId": "agent-operations-v3-source-first"
  },
  "coverage": {
    "mode": "ALL_TARGET_ACCEPTANCE_IDS",
    "acceptanceCount": 22,
    "sortedAcceptanceIdsDigest": "sha256:f625a89ee6837f14ba529166a6d892108c6836a8b7675cd4a596349dc5c494dd",
    "realCasePortfolioPolicy": "compact-real-case-portfolio/v1",
    "realCaseCount": 5,
    "realCaseIds": ["RC01", "RC02", "RC03", "RC04", "RC05"],
    "machineVariantCount": 10,
    "machineVariantIds": ["MV01", "MV02", "MV03", "MV04", "MV05", "MV06", "MV07", "MV08", "MV09", "MV10"]
  },
  "hostExecutionPolicy": {
    "policyVersion": "human-operated-workbuddy/v1",
    "completionPolicyVersion": "designated-human-range-completion/v1",
    "portfolioPolicyVersion": "compact-real-case-portfolio/v1",
    "workBuddyOperator": "DESIGNATED_HUMAN",
    "codexRole": "RUNBOOK_ISSUANCE_AND_FINAL_DECLARATION_ONLY",
    "workBuddyUiControlAllowed": false,
    "workBuddyObservationAllowed": false,
    "workBuddyExecutionArtifactsRequired": false,
    "perCaseReportRequired": false,
    "automatedWorkBuddyQualificationRequired": false,
    "automatedWorkBuddyTransportReceiptRequired": false,
    "independentHostAutomationAllowed": true,
    "finalDeclaration": "RC01～RC05 已完成",
    "acceptedRangeSeparators": ["～", "~"],
    "beforeDeclaration": "PENDING",
    "afterDeclaration": "PASSED",
    "workBuddyCaseIds": ["RC01", "RC02", "RC03", "RC04", "RC05"],
    "discoveryOnlyCaseIds": [],
    "nonWorkBuddyMachineVariantIds": ["MV01", "MV02", "MV03", "MV04", "MV05", "MV06", "MV07", "MV08", "MV09", "MV10"]
  },
  "executionOrder": [
    "VERIFY_APPROVED_TARGET_REVISION_1_AND_EXTERNAL_CANDIDATE_BINDING",
    "VERIFY_ALL_22_CURRENT_AND_247_INHERITED_ACCEPTANCE_CRITERIA",
    "FREEZE_EXACTLY_FIVE_CANDIDATE_BOUND_WORKBUDDY_RUNBOOKS",
    "EXECUTE_AUTHORIZED_10_NON_WORKBUDDY_MACHINE_VARIANTS_UNTIL_FAILURE_OR_HUMAN_GATE",
    "KEEP_ALL_FIVE_WORKBUDDY_LEGS_PENDING_UNTIL_FINAL_DECLARATION",
    "VERIFY_NO_REGRESSION_AND_TARGET_GATES"
  ],
  "prohibitedEffects": [
    "No Candidate identity in this Target manifest",
    "No Codex WorkBuddy operation or observation",
    "No WorkBuddy execution-artifact request",
    "No Source execution or mutation",
    "No executable Pack content, unbounded OWL or SWRL reasoning, or shared mutable ontology",
    "No LLM-, Host-, imported-vocabulary-, federation-, or external-reasoner-owned identity, trust, merge, approval, publication, installation, activation, mutation, or lifecycle decision",
    "No stale, partial, mixed-context, unsupported, or eventually authoritative semantic result",
    "No cloud control plane, EvoPilot Runtime implementation, or claim of terminal cross-product E2E completion",
    "No automatic repair, Catalog activation, publication, or Release"
  ],
  "authority": {
    "authorizesHostMutation": false,
    "authorizesHumanDecision": false,
    "authorizesPublication": false,
    "authorizesRelease": false
  }
}
