{
  "schema": "evopilot-real-host-acceptance-manifest/v3",
  "id": "evopilot-harness-v4.6.0-target-revision-1-real-host",
  "target": {
    "id": "evopilot-harness-v4.6.0-professional-reasoning-and-ontology-grounding",
    "revision": 1,
    "status": "APPROVED",
    "repoPath": "governance/targets/evopilot-harness-v4.6.0-professional-reasoning-and-ontology-grounding.json",
    "fileDigest": "sha256:386ecc41e08fa6617a7da55a792ff6c0d1614d1a284dfff7cd25efe99a9c2fbc",
    "authorizationDigest": "sha256:202ce651fa0ad4f5d417dc99c67e7d39d6344028f52b39f3246be2cc6aea9810",
    "roadmapDigest": "sha256:fee3c3313fdc286fe6408835c5bbffce274ee1b885c2a38fe522332cc688d8b4"
  },
  "requiredExtensions": {
    "hostAdapterId": "workbuddy-macos-designated-human-v1",
    "compatibilityAdapterId": "agent-operations-v3-source-first"
  },
  "coverage": {
    "mode": "ALL_TARGET_ACCEPTANCE_IDS",
    "acceptanceCount": 22,
    "sortedAcceptanceIdsDigest": "sha256:f625a89ee6837f14ba529166a6d892108c6836a8b7675cd4a596349dc5c494dd",
    "realCasePortfolioPolicy": "compact-real-case-portfolio/v1",
    "realCaseCount": 5,
    "realCaseIds": ["RC01", "RC02", "RC03", "RC04", "RC05"],
    "machineVariantCount": 12,
    "machineVariantIds": ["MV01", "MV02", "MV03", "MV04", "MV05", "MV06", "MV07", "MV08", "MV09", "MV10", "MV11", "MV12"]
  },
  "hostExecutionPolicy": {
    "policyVersion": "human-operated-workbuddy/v1",
    "completionPolicyVersion": "designated-human-range-completion/v1",
    "portfolioPolicyVersion": "compact-real-case-portfolio/v1",
    "workBuddyOperator": "DESIGNATED_HUMAN",
    "codexRole": "RUNBOOK_ISSUANCE_AND_FINAL_DECLARATION_ONLY",
    "workBuddyUiControlAllowed": false,
    "workBuddyObservationAllowed": false,
    "workBuddyExecutionArtifactsRequired": false,
    "perCaseReportRequired": false,
    "automatedWorkBuddyQualificationRequired": false,
    "automatedWorkBuddyTransportReceiptRequired": false,
    "independentHostAutomationAllowed": true,
    "finalDeclaration": "RC01～RC05 已完成",
    "acceptedRangeSeparators": ["～", "~"],
    "beforeDeclaration": "PENDING",
    "afterDeclaration": "PASSED",
    "workBuddyCaseIds": ["RC01", "RC02", "RC03", "RC04", "RC05"],
    "discoveryOnlyCaseIds": [],
    "nonWorkBuddyMachineVariantIds": ["MV01", "MV02", "MV03", "MV04", "MV05", "MV06", "MV07", "MV08", "MV09", "MV10", "MV11", "MV12"]
  },
  "executionOrder": [
    "VERIFY_APPROVED_TARGET_REVISION_1_AND_EXTERNAL_RELEASE_BUILD_BINDING",
    "VERIFY_ALL_22_CURRENT_AND_203_INHERITED_ACCEPTANCE_CRITERIA",
    "FREEZE_EXACTLY_FIVE_RELEASE_BUILD_BOUND_WORKBUDDY_RUNBOOKS",
    "EXECUTE_AUTHORIZED_12_NON_WORKBUDDY_MACHINE_VARIANTS_UNTIL_FAILURE_OR_HUMAN_GATE",
    "KEEP_ALL_FIVE_WORKBUDDY_LEGS_PENDING_UNTIL_FINAL_DECLARATION",
    "VERIFY_NO_REGRESSION_AND_TARGET_GATES"
  ],
  "prohibitedEffects": [
    "No Candidate identity in this Target manifest",
    "No Codex WorkBuddy operation or observation",
    "No WorkBuddy execution-artifact request",
    "No Source execution or mutation",
    "No LLM-owned ontology identifier or governed decision",
    "No ProjectOntologyArtifactSet or ProjectOntologySkill publication in v4.6.0",
    "No hidden extra human RC or sampled-away assertion failure",
    "No automatic repair, Catalog activation, publication or Release"
  ],
  "authority": {
    "authorizesHostMutation": false,
    "authorizesHumanDecision": false,
    "authorizesPublication": false,
    "authorizesRelease": false
  }
}
