{
  "schema": "evopilot-real-host-acceptance-manifest/v3",
  "id": "evopilot-harness-v4.5.0-target-revision-11-real-host",
  "target": {
    "id": "evopilot-harness-v4.5.0-declarative-user-taxonomy",
    "revision": 11,
    "status": "APPROVED",
    "repoPath": "governance/targets/evopilot-harness-v4.5.0-declarative-user-taxonomy.json",
    "fileDigest": "sha256:83f7187a7f237b6f0d70c771e27c46faf61d973989d5a70519c2b78e8e9e02a3",
    "authorizationDigest": "sha256:e1337fd7cb15e4d67499d17bc8a2a498e21b5b0de78273cd3bf6a6452c88a1c1",
    "roadmapDigest": "sha256:4c56088ede226a012a26012dee37f80fc2b7305bf3b40d6ef9feb117dc9557f5"
  },
  "requiredExtensions": {
    "hostAdapterId": "workbuddy-macos-designated-human-v1",
    "compatibilityAdapterId": "agent-operations-v3-source-first"
  },
  "coverage": {
    "mode": "ALL_TARGET_ACCEPTANCE_IDS",
    "acceptanceCount": 203,
    "sortedAcceptanceIdsDigest": "sha256:ff14dbc8ade7bcb64096c19072ab28fd9954beb9edabf7ea70b47e714ecf602b",
    "realCaseCount": 18,
    "realCaseIds": [
      "RC01", "RC02", "RC03", "RC04", "RC05", "RC06",
      "RC07", "RC08", "RC09", "RC10", "RC11", "RC12",
      "RC13", "RC14", "RC15", "RC16", "RC17", "RC18"
    ]
  },
  "hostExecutionPolicy": {
    "policyVersion": "human-operated-workbuddy/v1",
    "completionPolicyVersion": "designated-human-range-completion/v1",
    "workBuddyOperator": "DESIGNATED_HUMAN",
    "codexRole": "RUNBOOK_ISSUANCE_AND_FINAL_DECLARATION_ONLY",
    "workBuddyUiControlAllowed": false,
    "workBuddyObservationAllowed": false,
    "workBuddyExecutionArtifactsRequired": false,
    "perCaseReportRequired": false,
    "automatedWorkBuddyQualificationRequired": false,
    "automatedWorkBuddyTransportReceiptRequired": false,
    "independentHostAutomationAllowed": true,
    "finalDeclaration": "RC01～RC18 已完成",
    "acceptedRangeSeparators": ["～", "~"],
    "beforeDeclaration": "PENDING",
    "afterDeclaration": "PASSED",
    "workBuddyCaseIds": [
      "RC01", "RC02", "RC03", "RC04", "RC05", "RC06",
      "RC07", "RC08", "RC09", "RC10", "RC11", "RC12",
      "RC13", "RC14", "RC15", "RC17", "RC18"
    ],
    "discoveryOnlyCaseIds": ["RC16"]
  },
  "executionOrder": [
    "OFFLINE_STABLE_CORE_AND_COMPATIBILITY_REGRESSION",
    "VALIDATE_EXTERNAL_CANDIDATE_BINDING_AND_PACKAGE_IDENTITY",
    "VERIFY_APPROVED_TARGET_AND_CANDIDATE_ACCEPTANCE_BINDING",
    "REVIEWED_INSTALLED_SKILL_SYNC_WITHOUT_CANDIDATE_REINSTALL",
    "GENERATE_COMPLETE_HUMAN_WORKBUDDY_RUNBOOK_SET",
    "DESIGNATED_HUMAN_COMPLETES_WORKBUDDY_RUNBOOKS_PRIVATELY",
    "FINAL_RANGE_DECLARATION_TRANSITIONS_WORKBUDDY_LEGS_TO_PASSED",
    "VERIFY_NON_WORKBUDDY_EVIDENCE_AND_TARGET_GATES"
  ],
  "prohibitedEffects": [
    "No Codex or Skill WorkBuddy UI action or observation",
    "No Computer Use, Accessibility, coordinate, mouse, keyboard, clipboard, SO06, startup probe or automated WorkBuddy transport receipt",
    "No WorkBuddy screenshot, transcript, receipt, digest, export or per-case report requirement",
    "No inferred WorkBuddy pass before the exact final range declaration",
    "No Candidate reinstall or Host mutation without exact reviewed installation authorization",
    "No transfer of a superseded Candidate's WorkBuddy declaration, discovery selection or counted acceptance evidence to the active Candidate",
    "No acceptance Source mutation, substitution or post-result replacement",
    "No final declaration substitution for independent-Host, deterministic Engine or other non-WorkBuddy evidence",
    "No automatic human decision, cleanup, publication or release"
  ],
  "authority": {
    "checklistOnly": true,
    "authorizesHostMutation": false,
    "authorizesHumanDecision": false,
    "authorizesPublication": false,
    "authorizesRelease": false
  }
}
